id	word	definition_cn	phonetic_uk	phonetic_us	ecdict_translation	ecdict_phonetic	ecdict_definition
IELTS_612	pole	n. 极	/pəʊl/	/pol/	n. 波兰人, 极点, 磁极, 电极, 杆, 竿, 相反的极端 / vt. 用竿支撑 / vi. 撑篙	pәul	n. a long (usually round) rod of wood or metal or plastic / n. a native or inhabitant of Poland / n. one of two divergent or mutually exclusive opinions / n. one of two points of intersection of the Earth's axis and the celestial sphere
IELTS_614	polish	v. 磨光，擦光；润饰，使优美； n. 擦光剂	/'pɒlɪʃ/	/'pɑlɪʃ/	a. 波兰的 / n. 波兰人, 上光剂, 光泽, 优雅 / vt. 擦亮, 擦去, 使完美 / vi. 擦亮, 变得光亮	'pɒliʃ	n. the property of being smooth and shiny / n. a highly developed state of perfection; having a flawless or impeccable quality / n. a preparation used in polishing / n. the Slavic language of Poland
IELTS_616	pollinate	v. 授以花粉	/'pɒlɪneɪt/	/'pɑlənet/	vt. 对...授粉	'pɒlineit	v. fertilize by transfering pollen
IELTS_617	pompous	adj. 自负的，夸大的	/'pɒmpəs/	/'pɑmpəs/	a. 爱炫耀的, 虚夸的, 盛大的	'pɒmpәs	a. characterized by pomp and ceremony and stately display
IELTS_1430	portable	adj. 手提式的，便携式的	/'pɔːtəb(ə)l/	/'pɔrtəbl/	a. 可携带的, 可搬运的, 可移动的 / [计] 可移植的	'pɒ:tәbl	n. a small light typewriter; usually with a case in which it can be carried / a. easily or conveniently transported / s. of a motor designed to be attached to the outside of a boat's hull
IELTS_4705	post-mortem	n. 验尸，尸体解剖	/ˌpəust'mɔːtəm/	/ˌpoʊst ˈmɔrtəm/	adv. 死后 / [计] 事后剖析		n discussion of an event after it has occurred / n an examination and dissection of a dead body to determine cause of death or the changes produced by disease
IELTS_5070	precede	v. 领先， 先于	/prɪ'siːd/	/prɪ'sid/	vt. 在...之前, 优于, 较...优先 / vi. 在前面	.pri:'si:d	v. come before / v. be the predecessor of / v. move ahead (of others) in time or space / v. furnish with a preface or introduction
IELTS_3434	predispose	v. 事先影响某人； 偏爱； 易受感染	/ˌpriːdɪ'spəuz/	/'pridɪ'spoz/	vt. 预先处置, 使预先有倾向	.pri:di'spәuz	v. make susceptible
IELTS_3154	preface	n&v. 序言；为加序	/ˈpref.ɪs/	/ˈpref.ɪs/	n. 序, 绪言, 前言 / vi. 作序, 写前言 / vt. 给...作序, 以...开始	'prefis	n a short introductory essay preceding the text of a book / v furnish with a preface or introduction
IELTS_3162	prescribe	v. 吩咐使用	/prɪ'skraɪb/	/prɪ'skraɪb/	v. 规定, 指定, 嘱咐, 开处方	pris'kraib	v issue commands or orders for
IELTS_3168	prestigious	adj. 有威信的；有声望的	/pre'stɪdʒəs/	/prɛ'stɪdʒəs/	a. 享有声望的	pre'stidʒiәs	s. exerting influence by reason of high status or prestige
IELTS_3169	presumably	adv. 假定地；也许	/prɪ'zjuːməblɪ/	/prɪ'zuməbli/	adv. 推测上, 大概	pri'zu:mәbli	r. by reasonable assumption
IELTS_4048	preventative	adj. 预防性的	/prɪ'ventətɪv/	/prɪ'vɛntətɪv/	a. 预防的, 防止的 / n. 预防法, 预防措施, 预防物, 预防药	pri'ventәtiv	n remedy that prevents or slows the course of an illness or disease / n any obstruction that impedes or is burdensome / n an agent or device intended to prevent conception / a tending to prevent or hinder / s preventing or contributing to the prevention of disease
IELTS_3175	previous	adj. 先前的	/'priːvɪəs/	/'privɪəs/	a. 早先的, 前面的, 过急的 / [法] 以前的, 生前的, 前述的	'pri:viәs	s. just preceding something else in time or order / s. too soon or too hasty
IELTS_637	prodigious	adj. 巨大的，奇妙的	/prə'dɪdʒəs/	/prə'dɪdʒəs/	a. 庞大的, 惊人的, 异常的	prәu'didʒәs	s so great in size or force or extent as to elicit awe / s of momentous or ominous significance / s far beyond what is usual in magnitude or degree
IELTS_4343	prolonged	adj. 持久的， 长期的	/prə'lɒŋd/	/pro'lɔŋd/	a. 延续的, 长时间的	prә'lɔŋd	v lengthen in time; cause to be or last longer / v lengthen or extend in duration or space / s relatively long in duration; tediously protracted / s drawn out or made longer spatially
IELTS_2318	prospectus	n. 说明书，简介	/prə'spektəs/	/prə'spɛktəs/	n. 创办计划书, (内容)说明书, 内容简介 / [经] (募债)说明书	prәs'pektәs	n. a formal written offer to sell securities (filed with the SEC) that sets forth a plan for a (proposed) business enterprise
IELTS_2325	provided	conj. 假如，如果	/prə'vaɪdɪd/	/prə'vaɪdɪd/	conj. 倘若, 以...为条件	prә'vaidid	v give something useful or necessary to / v give what is desired or needed, especially support, food or sustenance / v determine (what is to happen in certain contingencies), especially by including a proviso condition or stipulation / v mount or put up / v make a possibility or provide opportunity for; permit to be attainable or cause to remain / v supply means of subsistence; earn a living / v take measures in preparation for
IELTS_4861	prowess	n. 杰出的才能， 高超的技艺， 专长， 造诣	/'prauəs/	/'praʊəs/	n. 英勇, 勇敢, 超凡技术	'prauis	n a superior skill that you can learn by study and practice and observation
IELTS_2331	pry	v. 细查；探问	/praɪ/	/praɪ/	n. 杠杆, 窥探, 好奇者 / vi. 打听, 窥探 / vt. 撬动, 撬开, 费力得到	prai	v. to move or force, especially in an effort to get something open / v. be nosey / v. make an uninvited or presumptuous inquiry
IELTS_3952	psychiatric	adj. 精神病的； 治疗精神病的	/ˌsaɪki'ætrɪk/	/,saɪkɪ'ætrɪk/	a. 精神病学的, 医精神病的 / [医] 精神病学的	saiki'ætrik; (?@) si-	a. relating to or used in or engaged in the practice of psychiatry
IELTS_3176	pull	v&n. 拉，拖，拔	/pʊl/	/pʊl/	vt. 拉, 拖, 拔, 牵, 撕开, 吸引 / vi. 拉, 拖, 拔, 有吸引力 / n. 拉, 拖, 拔, 拉力, 牵引力, 划船, 吸引	pul	n. the act of pulling; applying force to move something toward or with you / n. the force used in pulling / n. special advantage or influence / n. a device used for pulling something
IELTS_3633	pulverise	v. 碾磨成粉， 粉碎	/'pʌlvəraɪz/	/'pʌlvəraɪz/	vt.vi. 使成粉末, 研磨, 把...压成粉末 / vt. (非正式)粉碎, 彻底打败, 彻底摧毁 / vi. 变成尘埃	'pʌlvәraiz	v destroy completely / v become powder or dust / v make into a powder by breaking up or cause to become dust
IELTS_3180	puncture	n. 小孔，刺孔	/'pʌŋ(k)tʃə/	/'pʌŋktʃɚ/	n. 刺痕, 穿刺 / vt. 刺穿, 刺, 揭穿 / vi. 被刺穿	'pʌŋktʃә	n. loss of air pressure in a tire when a hole is made by some sharp object / n. a small hole made by a sharp object / n. the act of puncturing or perforating / v. pierce with a pointed object; make a hole into
IELTS_3186	put	v. 放	/pʊt/	/pʊt/	vt. 放, 摆, 安置, 移动, 发射, 投掷, 写上, 表达, 使从事, 使受到, 驱使, 赋予 / vi. 出发, 航行, 发芽 / n. 掷, 股票出售权, 笨蛋 / a. 固定不动的 / [计] 发送文件	put	v. put into a certain place or abstract location / v. cause to be in a certain state; cause to be in a certain relation / v. attribute or give / v. cause (someone) to undergo something
IELTS_647	qualify	v. (使)合格	/'kwɒlɪfaɪ/	/ˈkwɑləˌfaɪ/	vi. 取得资格, 有资格 / vt. 使有资格, 使合格, 限定, 限制, 准予	'kwɒlifai	v. prove capable or fit; meet requirements / v. pronounce fit or able / v. make more specific / v. make fit or prepared
IELTS_1473	quiver	vt&vi. 颤动，抖动	/'kwɪvə/	/'kwɪvɚ/	n. 震动, 颤抖, 箭袋 / vi. 颤抖, 振动 / vt. 使颤动 / a. 敏捷的	'kwivә	n. case for holding arrows / v. shake with fast, tremulous movements
IELTS_1481	raft	n. 木排，木筏	/rɑːft/	/ræft/	n. 筏, 救生筏, 大量 / vi. 乘筏 / vt. 筏运, 制成筏	ræft	n. a flat float (usually made of logs or planks) that can be used for transport or as a platform for swimmers / v. transport on a raft / v. travel by raft in water / v. make into a raft
IELTS_1482	rage	n&vi. 狂怒	/reɪdʒ/	/redʒ/	n. 愤怒, 情绪激动, 狂暴 / vi. 大怒, 狂吹, 流行	reidʒ	n. a state of extreme anger / n. something that is desired intensely / n. violent state of the elements / v. be violent; as of fires and storms
IELTS_1492	rarely	adv. 非常地，难得	/'reəlɪ/	/'rɛrli/	adv. 很少地, 罕有地	'rєәli	r. not often
IELTS_3523	rarity	n. 稀有； 稀有的事物	/'reərəti/	/'rɛrəti/	n. 稀罕, 罕有, 珍奇, 稀薄	'rєәrәti	n. noteworthy scarcity / n. a rarified quality
IELTS_2337	rave	v. 胡言乱语；热衷谈论； n. 热情赞扬	/reɪv/	/rev/	n. 狂吼, 狂暴 / v. 愤怒地说, 叫嚷, 咆哮	reiv	n. a dance party that lasts all night and electronically synthesized music is played / n. an extravagantly enthusiastic review / v. participate in an all-night techno dance party / v. praise enthusiastically
IELTS_2344	reassure	v. 使放心，使消除疑虑	/riːə'ʃʊə/	/,riə'ʃʊr/	vt. 使...安心, 向...再保证 / [法] 重新保证, 再保险, 使清除疑虑	.ri:ә'ʃuә	v. cause to feel sure; give reassurance to / v. give or restore confidence in; cause to feel sure or certain
IELTS_4040	recapture	v. 重获， 收复	/ˌriː'kæptʃə(r)/	/,ri'kæptʃɚ/	n. 取回, 夺回 / vt. 再捕获, 夺回, 重温	.ri:'kæptʃә	n. a legal seizure by the government of profits beyond a fixed amount / n. the act of taking something back / v. experience anew / v. take up anew
IELTS_2346	recede	v. 后退；向后倾斜	/rɪ'siːd/	/rɪ'sid/	vi. 向后退, 退却, 收回, 降低, 减弱 / [医] 退缩	ri'si:d	v. become faint or more distant
IELTS_2351	recipient	n. 接受者	/rɪ'sɪpɪənt/	/rɪ'sɪpɪənt/	a. 领受的, 容易接受的, 感受性强的 / n. 领受者, 容纳者, 容器	ri'sipiәnt	n. a person who receives something
IELTS_5150	reconstruction	n. 重建； 再现	/ˌriːkən'strʌkʃn/	/,rikən'strʌkʃən/	n. 改造, 再建 / [医] 改建, 改造, 翻造	.ri:kәn'strʌkʃәn	n. the period after the American Civil War when the southern states were reorganized and reintegrated into the Union; 1865-1877 / n. the activity of constructing something again / n. an interpretation formed by piecing together bits of evidence
IELTS_3192	recruit	v&n. 招募，吸收	/rɪ'kruːt/	/rɪ'krut/	n. 新兵, 新手, 新会员, 补给品 / vt. 恢复, 补充, 充实, 征募 / vi. 征募新兵, 复原, 得到补充	ri'kru:t	n. a recently enlisted soldier / n. any new member or supporter (as in the armed forces) / v. seek to employ / v. cause to assemble or enlist in the military
IELTS_4551	redevelopment	n. 重新规划； 重新建设	/ˌriːdɪ'veləpmənt/	/,ridɪ'vɛləpmənt/	n. 再开发；重点恢复		n the act of improving by renewing and restoring
IELTS_3198	reel	n. 卷，轴；(胶片)一盘； v. 卷	/riːl/	/ril/	n. 卷轴, 一卷, 纺车, 旋转, 蹒跚 / vt. 卷...于轴上, 绕, 使旋转 / vi. 蹒跚地走, 旋转, 眩晕, 摇晃, 退缩 / [计] 卷; 盘	ri:l	n. a roll of photographic film holding a series of frames to be projected by a movie projector / n. music composed for dancing a reel / n. winder consisting of a revolving spool with a handle; attached to a fishing rod / n. a lively dance of Scottish Highlanders; marked by circular moves and gliding steps
IELTS_3200	referendum	n. 公民投票、复决权	/,refə'rendəm/	/,rɛfə'rɛndəm/	n. （就重大政治或社会问题进行的）全民公决，全民投票	.refә'rendәm	n. a legislative act is referred for final approval to a popular vote by the electorate
IELTS_3202	refrain	v. 抑制	/rɪ'freɪn/	/rɪ'fren/	n. 重复的话, 叠句, 副歌 / vi. 节制, 避免, 克制	ri'frein	n. the part of a song where a soloist is joined by a group of singers / v. resist doing something
IELTS_4507	refresh	v. 复原， 更新； 精神振作， 精力恢复	/rɪ'freʃ/	/ri'frɛʃ/	vt. 使清新, 使恢复, 使生气蓬勃 / vi. 提起精神, 恢复精神, 吃点心, 喝饮料 / vt. 刷新, 重新整理 / vi. 刷新, 重新整理 / [计] 刷新, 重新整理	ri'freʃ	v. make (to feel) fresh / v. make fresh again
IELTS_4042	refresher	n. 提神物； 帮助记忆的东西或人； 补习课程	/rɪ'freʃə(r)/	/rɪ'freʃə(r)/	n. 使清新的事物, 使恢复记忆的事物, 饮料, 酒, 复习, 最新动态介绍, 补习材料 / [医] 复习课程	'ri'freʃә	n. a fee (in addition to that marked on the brief) paid to counsel in a case that lasts more than one day / n. a drink that refreshes
IELTS_3203	refreshing	adj. 使精力恢复的；使耳目一新的	/rɪ'freʃɪŋ/	/ri'frɛʃɪŋ/	a. 使清爽的, 有精神的, 爽快的	ri'freʃiŋ	v refresh one's memory / v make (to feel) fresh / v become or make oneself fresh again / v make fresh again / s imparting vitality and energy / s pleasantly new or different
IELTS_657	regeneration	n. 新生，更新	/rɪdʒenə'reɪʃn/	/ridʒɛnə'reʃən/	n. 再生, 重建 / [化] 再生作用	ri.dʒenә'reiʃәn	n. (biology) growth anew of lost tissue or destroyed parts or organs / n. the activity of spiritual or physical renewal
IELTS_5190	regurgitate	v. 涌回， 流回； 【动】 反胃， 将返回到口中， 反刍	/rɪ'gɜːdʒɪtet/	/rɪ'ɡɝdʒɪtet/	v. (使)回涌, (使)回流, (使)反胃	ri'gә:dʒiteit	v. pour or rush back / v. feed through the beak by regurgitating previously swallowed food / v. repeat after memorization
IELTS_4942	reinvigorate	v. 使重新振作； 使恢复活力	/ˌriːɪn'vɪgəreɪt/	/,riɪn'vɪɡəret/	vt. 使再振作, 使复兴	.ri:in'vigәreit	v impart vigor, strength, or vitality to
IELTS_4218	rekindle	v. 重新点燃； 使复苏	/ˌriː'kɪndl/	/,ri'kɪndl/	vt. 再点火, 重新激起 / vi. 重新燃烧	.ri:'kindl	v. kindle anew, as of a fire / v. arouse again
IELTS_5016	reliance	n. 依靠， 依赖	/rɪ'laɪəns/	/rɪ'laɪəns/	n. 信任, 信赖, 受信赖的人(或事) / [法] 信任, 信赖, 信心	ri'laiәns	n. certainty based on past experience / n. the state of relying on something
IELTS_1497	remnant	n. 残(剩)余	/'remnənt/	/'rɛmnənt/	n. 剩余, 零料, 遗迹 / a. 剩余的, 残余的	'remnәnt	n a small part or portion that remains after the main part no longer exists / n a piece of cloth that is left over after the rest has been used or sold
IELTS_1503	renowned	adj. 有名望的，声誉鹊起的	/rɪ'naʊnd/	/ri'naund/	a. 有名的, 有声誉的	ri'naund	s widely known and esteemed
IELTS_4695	rental	adj. 租用的； 出租的； n. 租金额；出租，租赁	/'rentl/	/'rɛntl/	n. 租费, 租金收入 / a. 租赁的, 收取租金的	'rentl	n. the act of paying for the use of something (as an apartment or house or car) / a. available to rent or lease / a. of or relating to rent
IELTS_4754	repack	v. 重新包装； 重新填塞； 再装配； 拆修	/rɪ'pæk/	/rɪ'pæk/	n. 重新打包, 重新装箱	re'pæk	v. t. To pack a second time or anew; as, to repack beef; to /    repack a trunk.
IELTS_1505	repatriate	v. 遣返；返回	/riː'pætrɪeɪt; -'peɪ-/	/,ri'petrɪet/	vt. 把...遣返 / vi. 回国 / n. 被遣返回国者	ri:'pætrieit	n. a person who has returned to the country of origin or whose citizenship has been restored / v. send someone back to his homeland against his will, as of refugees / v. admit back into the country
IELTS_4623	replenish	v. 再斟满； 添加， 补充	/rɪ'plenɪʃ/	/rɪ'plɛnɪʃ/	vt. 把...重新补足, 把...再装满 / vi. 被再装满, 充满	ri'pleniʃ	v. fill something that had previously been emptied
IELTS_5162	reputable	adj. 名声好的， 高尚的； 受尊敬的； 值得信赖的	/'repjətəbl/	/'rɛpjətəbl/	a. 受好评的, 有声望的, 规范的 / [法] 声誉好的, 可尊敬的	'repjutәbl	a. having a good reputation
IELTS_5031	resit	v&n. 重修， 补考	/ˌrɪː'sɪt/	/ˈriːsɪt/	<英> vt.(尤指考试不及格后)再参加(考试) / vi.(考试不及格后)再考,重考	'ri:sit	
IELTS_2367	resort	vi&n. 求助	/rɪ'zɔːt/	/rɪ'zɔrt/	n. 度假胜地, 手段, 凭借, 常去之地 / vi. 诉诸, 常去	ri'zɒ:t	n. a hotel located in a resort area
IELTS_3939	responsible	adj. 有责任感的； 可靠的	/rɪ'spɒnsəbl/	/rɪ'spɑnsəbl/	a. 有责任的, 负责的, 责任重大的 / [法] 应负责任的, 有责任的, 能履行责任的	ri'spɒnsәbl	a. worthy of or requiring responsibility or trust; or held accountable / s. being the agent or cause
IELTS_2370	responsive	adj. 易于做出迅速反应的	/rɪ'spɒnsɪv/	/rɪ'spɑnsɪv/	a. 回答的, 应答的, 易感应的	ri'spɒnsiv	a. containing or using responses; alternating / a. readily reacting or replying to people or events or stimuli; showing emotion
IELTS_2371	restless	adj. 焦躁不安的	/ˈrestləs/	/'rɛstləs/	a. 不安静的, 慌张的, 休息不充分的 / [医] 不安静的, 不宁的	'restlis	s. worried and uneasy / s. ceaselessly in motion / a. lacking or not affording physical or mental rest
IELTS_2373	restrain	v. 限制，约束	/rɪ'streɪn/	/rɪ'stren/	vt. 抑制, 阻止, 束缚 / [法] 抑制, 遏制, 制止	ri'strein	v. keep under control; keep in check / v. to close within bounds, limit or hold back from movement / v. hold back
IELTS_2377	reticent	adj. 沉默寡言的；言不如意的	/'retɪs(ə)nt/	/'rɛtɪsnt/	a. 无言的, 沉默的, 不情愿的 / [法] 言不尽意的, 沈默寡言的, 有保留的	'retisnt	s. temperamentally disinclined to talk / s. reluctant to draw attention to yourself
IELTS_4392	reunite	v. 结合； 重聚	/ˌriːjuː'naɪt/	/,riju'naɪt/	v. (使)再联合	.ri:ju:'nait	v. have a reunion; unite again
IELTS_3219	revise	v. 修订；改正	/rɪ'vaɪz/	/rɪ'vaɪz/	n. 校订, 修正, 改样 / vt. 校订, 修正, 校正	ri'vaiz	v. make revisions in
IELTS_3222	revolve	vt&vi. 使旋转；使绕转	/rɪ'vɒlv/	/rɪ'vɔlv/	v. (使)旋转, 反复考虑, 循环出现	ri'vɒlv	v. turn on or around an axis or a center
IELTS_681	rim	n. 边；边缘，轮辋	/rɪm/	/rɪm/	n. 边, 轮缘, 框 / vt. 镶边, 为...装边 / vi. 形成边缘	rim	n. the shape of a raised edge of a more or less circular object / n. (basketball) the hoop from which the net is suspended / n. the outer part of a wheel to which the tire is attached / v. run around the rim of
IELTS_683	rip	v&n. 撕裂，撕开；扯破	/rɪp/	/rɪp/	n. 裂痕, 破绽, 拉裂, 浪子, 巨浪 / vi. 被拉开, 裂开, 猛冲 / vt. 撕, 扯, 劈	rip	n. an opening made forcibly as by pulling apart / n. a stretch of turbulent water in a river or the sea caused by one current flowing into or across another current / v. move precipitously or violently / v. cut (wood) along the grain
IELTS_690	roast	v&a. 烤(的)，烘(的)	/rəʊst/	/rost/	n. 烤肉, 烘烤, 嘲笑 / a. 烘烤的, 烤过的 / vt. 烤, 炙, 烘焙, 嘲笑 / vi. 烤, 炙, 烘焙	rәust	n. a piece of meat roasted or for roasting and of a size for slicing into more than one portion / v. cook with dry heat, usually in an oven / s. (meat) cooked by dry heat in an oven
IELTS_3484	romance	n. 恋爱； 浪漫爱情； 爱情小说， 传奇故事	/rəu'mæns/	/ro'mæns/	n. 冒险故事, 浪漫史, 传奇文学 / vi. 写传奇, 作空想, 虚构	rәu'mæns	n. the group of languages derived from Latin / n. a novel dealing with idealized events remote from everyday life / v. have a love affair with / v. tell romantic or exaggerated lies
IELTS_694	rot	v&n. 腐掉	/rɒt/	/rɑt/	n. 腐烂, 腐蚀, 败坏 / vi. 腐烂, 烂, 堕落, 憔悴 / vt. 使腐烂, 使腐朽, 使堕落	rɒt	n a state of decay usually accompanied by an offensive odor / n (biology) the process of decay caused by bacterial or fungal action / n unacceptable behavior (especially ludicrously false statements) / v break down / v become physically weaker
IELTS_696	rough	adj. 不平的；粗鲁的，粗略的；刺耳的	/rʌf/	/rʌf/	n. 粗糙的东西, 毛坯, 未加工品, 梗概, 草图, 暴徒, 艰难 / a. 粗糙的, 粗暴的, 蓬乱的, 草率的, 大致的, 简陋的, 暴风雨的, 艰难的 / vt. 使粗糙, 使不平, 使蓬乱, 粗制, 草拟, 粗暴对待, 对...动粗 / vi. 变粗糙 / adv. 粗糙地, 粗暴地	rʌf	n. the part of a golf course bordering the fairway where the grass is not cut short / a. having or caused by an irregular surface / s. (of persons or behavior) lacking refinement or finesse / a. of the margin of a leaf shape; having the edge cut or fringed or scalloped
IELTS_4738	rude	adj. 粗鲁的； 粗糙的	/ruːd/	/rud/	a. 粗鲁无礼的, 粗陋的, 粗暴的, 原始的, 未开化的, 大略的, 崎岖不平的, 狂暴的	ru:d	s socially incorrect in behavior / s (of persons) lacking in refinement or grace / a lacking civility or good manners / s (used especially of commodities) being unprocessed or manufactured using only simple or minimal processes / s belonging to an early stage of technical development; characterized by simplicity and (often) crudeness
IELTS_700	ruffle	vt&vi. 扰乱，打扰	/'rʌf(ə)l/	/'rʌfl/	n. 皱褶, 波纹, 生气, 混乱 / vt. 弄皱, 触怒, 洗(牌), 连续轻擂(鼓) / vi. 起皱, 发脾气, 连续轻擂	'rʌfl	v. trouble or vex / v. discompose / v. erect or fluff up / v. disturb the smoothness of
IELTS_1523	sack	n. 麻袋，解雇； v. 解雇；劫掠	/sæk/	/sæk/	n. 麻布袋, 洗劫 / vt. 把...装入袋, 洗劫	sæk	n. a bag made of paper or plastic for holding customer's purchases / n. the quantity contained in a sack / n. any of various light dry strong white wine from Spain and Canary Islands (including sherry) / n. a woman's full loose hiplength jacket
IELTS_1534	sanity	n. 心智健全，神智正常；判断正确	/'sænɪtɪ/	/'sænəti/	n. 神智健全, 头脑清楚, 通情达理 / [医] 精神健全	'sæniti	n. normal or sound powers of mind
IELTS_2378	say	v. 说	/seɪ/	/se/	vt. 说, 讲, 念, 说明, 指明 / vi. 说, 讲 / n. 意见, 发言权	sei	n. the chance to speak / v. communicate or express nonverbally / v. utter aloud / v. state as one's opinion or judgement; declare
IELTS_3239	scrape	v&n. 刮, 擦"	/skreɪp/	/skrep/	n. 刮, 擦, 挖, 擦痕, 刮擦声, 困境 / vi. 刮掉, 擦掉, 刮出刺耳声 / vt. 刮, 擦, 擦伤, 挖成, 积蓄	skreip	n. a harsh noise made by scraping / n. a deep bow with the foot drawn backwards (indicating excessive humility) / v. scratch repeatedly / v. make by scraping
IELTS_4454	scrupulous	adj. 多顾虑的， 谨慎的； 一丝不苟的， 严谨的	/'skruːpjələs/	/'skrupjələs/	a. 小心谨慎的, 细心的	'skru:pjulәs	a. having scruples; arising from a sense of right and wrong; principled
IELTS_3244	scrutiny	n. 细察，调查	/'skruːtɪnɪ/	/'skrutəni/	n. 细看, 仔细检查, 监视, 选票检查 / [经] 复查, 评核, 仔细检查	'skru:tini	n. a prolonged intense look
IELTS_707	seemingly	adv. 好像；似乎	/'siːmɪŋlɪ/	/'simɪŋli/	adv. 看来似乎, 表面上看来	'si:miŋli	r from appearances alone
IELTS_5042	sensational	adj. 轰动性的， 引起哗然的； 耸人听闻的； 极好的； 绝妙的	/sen'seɪʃənl/	/sɛn'seʃənl/	a. 使人感动的, 非常好的	sen'seiʃәnl	a. causing intense interest, curiosity, or emotion / a. relating to or concerned in sensation
IELTS_4129	sentient	adj. 有感觉能力的， 有知觉力的； 知悉的	/'senʃnt;'sentɪənt/	/'sɛntɪənt/	a. 有感觉力的, 意识到的 / n. 有知觉的人	'senʃәnt	a. endowed with feeling and unstructured consciousness / s. consciously perceiving
IELTS_720	set	v. (日，月)落，vt放	/set/	/sɛt/	n. 日落, 同伙, 组合, 集合, 装置 / vt. 放, 安置, 放置, 设定, 使凝结, 点燃, 确定, 点缀, 使就位, 树立, 分配, 调整 / vi. 日落, 凝固, 定型, 搁住, 结果, 适合 / a. 决心的, 规定的, 故意的, 持久的, 固定的, 老套的, 准备好的 / [计] 设置; DOS内部命令:改变或显示分配给环境变量的值	set	n. a group of things of the same kind that belong together and are so used / n. (mathematics) an abstract collection of numbers or symbols / n. several exercises intended to be done in series / n. an unofficial association of people or groups
IELTS_2394	shave	v&n. 剃；刮	/ʃeɪv/	/ʃev/	n. 修面, 刮胡子, 幸免, 剃刀 / vt. 修面, 剃, 修剪, 掠过 / vi. 刮脸, 勉强通过	ʃeiv	n. the act of removing hair with a razor / v. remove body hair with a razor / v. cut closely / v. cut the price of
IELTS_2395	shear	v. 剪	/ʃɪə/	/ʃɪr/	n. 修剪, 剪下的东西, 大剪刀, 切变, 剪切机, 切 / vt. 修剪, 割, 剥夺, 横越, 削剪 / vi. 剪, 修剪, 剪羊毛, 切断	ʃiә	n. (physics) a deformation of an object in which parallel planes remain parallel but are shifted in a direction parallel to themselves / n. a large edge tool that cuts sheet metal by passing a blade through it / v. cut with shears / v. cut or cut through with shears
IELTS_2398	sheet	n. 被单；薄板	/ʃiːt/	/ʃit/	n. 床单, 张, 纸张, 印刷品, 裹尸布, 薄片 / vt. 盖上被单, 遍布 / vi. 大片落下 / a. 片状的, 成薄片的 / [计] 工作表	ʃi:t	n. any broad thin expanse or surface / n. paper used for writing or printing / n. bed linen consisting of a large rectangular piece of cotton or linen cloth; used in pairs / n. a flat artifact that is thin relative to its length and width
IELTS_2399	shell	n&v. 壳，剥壳	/ʃel/	/ʃɛl/	n. 贝壳, 壳, 外形, 炮弹 / vt. 去壳, 脱落, 炮轰 / vi. 剥落, 脱壳 / [计] 外壳; DOS内部命令:指定命令行处理程序	ʃel	n. ammunition consisting of a cylindrical metal casing containing an explosive charge and a projectile; fired from a large gun / n. the material that forms the hard outer covering of many animals / n. the hard usually fibrous outer layer of some fruits especially nuts / n. the exterior covering of a bird's egg
