id	word	definition_cn	phonetic_uk	phonetic_us	ecdict_translation	ecdict_phonetic	ecdict_definition
IELTS_2918	glossary	n. 词汇表；术语汇编	/'glɒs(ə)rɪ/	/'ɡlɑsəri/	n. 专业词典, 术语集, 词表 / [计] 图文集	'glɒsәri	n. an alphabetical list of technical terms in some specialized field of knowledge; usually published as an appendix to a text on that field
IELTS_2920	glue	n. 胶水，胶； v. 粘贴，紧贴	/gluː/	/ɡlu/	n. 胶, 粘性物 / vt. 粘合, 胶合	glu:	n. cement consisting of a sticky substance that is used as an adhesive / v. join or attach with or as if with glue / v. be fixed as if by glue
IELTS_4365	glutamate	n. 谷氨酸； 谷酸盐	/'gluːtəmeɪt/	/'ɡlʊtə,met/	n. 谷氨酸盐, 味精, 谷氨酸脂 / [医] 谷氨酸盐	'^lu:tәmeit	n. a salt or ester of glutamic acid
IELTS_1201	gown	n. 长袍；长外衣	/gaʊn/	/ɡaʊn/	n. 睡衣, 法衣, 大学全体师生 / vt. 使穿睡衣	gaun	n. a woman's dress, usually with a close-fitting bodice and a long flared skirt, often worn on formal occasions / n. the members of a university as distinguished from the other residents of the town in which the university is located / n. protective garment worn by surgeons during operations / n. outerwear consisting of a long flowing garment used for official or ceremonial occasions
IELTS_1213	gratitude	adj. 感激，感恩	/'grætɪtjuːd/	/'ɡrætɪtud/	n. 感激之情	'grætitju:d	n. a feeling of thankfulness and appreciation
IELTS_1215	grave	adj. 严重的； n. 墓	/greɪv/	/ɡrev/	n. 墓穴, 坟墓, 终结, 死亡 / a. 庄重的, 严肃的, 重大的, 低沉的 / vt. 雕刻	greiv	n. death of a person / n. a place for the burial of a corpse (especially beneath the ground and marked by a tombstone) / s. dignified and somber in manner or character and committed to keeping promises / s. of great gravity or crucial import; requiring serious thought
IELTS_1217	gravity	n. 地球引力；重量；严重性	/'grævɪtɪ/	/'ɡrævəti/	n. 地心引力, 重力 / [化] 重力	'græviti	n. (physics) the force of attraction between all masses in the universe; especially the attraction of the earth's mass for bodies near its surface / n. a solemn and dignified feeling
IELTS_4689	greasy	adj. 多脂的； 油滑的	/'griːsi;'griːzi/	/'grisi/	a. 油腻的, 含脂肪多的	'gri:zi	s. containing an unusual amount of grease or oil / s. smeared or soiled with grease or oil
IELTS_2022	grid	n. 高压输电线路网；地图坐标方格；格栅	/grɪd/	/ɡrɪd/	n. 格子, 栅格 / [计] 网格	grid	n. a pattern of regularly spaced horizontal and vertical lines / n. a perforated or corrugated metal plate used in a storage battery as a conductor and support for the active material / n. an electrode placed between the cathode and anode of a vacuum tube to control the flow of electrons through the tube / n. a cooking utensil of parallel metal bars; used to grill fish or meat
IELTS_2026	grim	adj. 严格的，严厉的	/grɪm/	/ɡrɪm/	a. 冷酷的, 坚强的, 残忍的, 可怕的, 讨厌的	grim	s. not to be placated or appeased or moved by entreaty
IELTS_2030	grit	n. 粗砂；刚毅，勇气； v. 铺沙砾于	/grɪt/	/ɡrɪt/	n. 砂砾, 粗砂石 / vt. 覆以砂砾, 咬牙切齿地说 / vi. 摩擦作声	grit	n. a hard coarse-grained siliceous sandstone / v. cover with a grit / v. clench together
IELTS_2031	groa	n v&n. 呻吟，呻吟着表示;承受重压发出的声音	/groa/	/groa/	[网络] 女巫医格萝雅；一种癌蛋白；格萝亚		
IELTS_4868	grocery	n. 杂货店； 食品， 杂货	/'grəusəri/	/'ɡrosəri/	n. 食品杂货店, 食品杂货业	'grәusәri	n. (usually plural) consumer goods sold by a grocer
IELTS_2033	gross	adj. 粗俗的；过胖的；总的；毛的； v. 计得	/grəʊs/	/ɡros/	n. 总数, 总量 / a. 总共的, 未打折扣的, 恶劣的, 粗野的 / vt. 总共收入	grәus	n. twelve dozen / n. the entire amount of income before any deductions are made / v. earn before taxes, expenses, etc. / a. before any deductions
IELTS_2039	guideline	n. (常作pl)	/'gaɪdlaɪn/	/'ɡaɪdlaɪn/	n. 指导路线, 方针, 指标 / [经] 指导路线, 方针, 准则	'gaidlain	n. a light line that is used in lettering to help align the letters
IELTS_5044	guinea	n. 几尼	/'gɪni/	/'ɡɪni/	n. 几内亚	'gini	n. a former British gold coin worth 21 shillings / n. a republic in western Africa on the Atlantic; formerly a French colony; achieved independence from France in 1958
IELTS_2042	gust	n. 阵风，(感情的)迸发	/gʌst/	/ɡʌst/	n. 突然一阵, 趣味, 爱好	gʌst	n. a strong current of air
IELTS_3886	handy	adj. 方便的； 手边的； 手巧的	/'hændi/	/'hændi/	a. 便利的, 敏捷的, 容易取得的 / [化] 便于使用的; 易操作的	'hændi	n. United States blues musician who transcribed and published traditional blues music (1873-1958) / s. easy to reach / s. easy to use / s. skillful with the hands
IELTS_343	haphazard	a&ad. 杂乱的(地)，任意的(地)	/hæp'hæzəd/	/'hæphæzəd/	n. 偶然性, 偶然事件 / a. 无计划的, 偶然的, 随便的 / adv. 偶然地	hæp'hæzәd	s. dependent upon or characterized by chance / s. marked by great carelessness / r. without care; in a slapdash manner
IELTS_351	harness	v. 上挽具；治理；利用； n. 挽具，降落伞背带	/'hɑːnɪs/	/'hɑrnɪs/	n. 马具, 挽具状带子, 甲胄 / vt. 给...上挽具, 驾驭, 披上甲胄, 利用...以产生动力	'hɑ:nis	n. a support consisting of an arrangement of straps for holding something to the body (especially one supporting a person suspended from a parachute) / n. stable gear consisting of an arrangement of leather straps fitted to a draft animal so that it can be attached to and pull a cart / v. put a harness / v. exploit the power of
IELTS_353	haste	n. 急速，仓促	/heɪst/	/hest/	n. 匆忙, 急忙	heist	n. overly eager speed (and possible carelessness) / n. the act of moving hurriedly and in a careless manner
IELTS_354	hasty	adj. 急速的；匆促的	/'heɪstɪ/	/'hesti/	a. 匆匆的, 轻率的, 性怠的	'heisti	s. excessively quick / s. done with very great haste and without due deliberation
IELTS_359	havoc	n. 大灾难，浩劫	/'hævək/	/'hævək/	n. 大破坏, 蹂躏 / vt. 严重破坏	'hævәk	n. violent and needless disturbance
IELTS_4381	headline	n. 大字标题；	/'hedlaɪn/	/'hɛdlaɪn/	n. 大标题, 新闻摘要 / vt. 为...做标题, 写标题	'hedlain	n. the heading or caption of a newspaper article / v. publicize widely or highly, as if with a headline / v. provide (a newspaper page or a story) with a headline
IELTS_4541	headmaster	n. 校长	/ˌhed'mɑːstə(r)/	/,hɛd'mæstɚ/	n. (中小学)校长, 监工	'hed'mɑ:stә	n. presiding officer of a school
IELTS_4335	healing	adj. 有治疗作用的； n. 康复，复原	/'hiːlɪŋ/	/'hilɪŋ/	a. 治愈的, 恢复健康的 / [计] 修复, 恢复	'hi:liŋ	n. the natural process by which the body repairs itself
IELTS_1222	hearing	n. 听力，听力所及距离，被听到机会；审讯	/'hɪərɪŋ/	/'hɪrɪŋ/	n. 听, 听觉, 听讯 / [医] 听, 听觉	'hiәriŋ	n. (law) a proceeding (usually by a court) where evidence is taken for the purpose of determining an issue of fact and reaching a decision based on that evidence / n. an opportunity to state your case and be heard / n. a session (of a committee or grand jury) in which witnesses are called and testimony is taken / n. the ability to hear; the auditory faculty
IELTS_1225	hectic	adj. 闹哄哄的，兴奋的	/'hektɪk/	/'hɛktɪk/	a. 脸上发红, 发热的, 潮热的, 肺病的 / n. 脸红, 潮热病人	'hektik	s marked by intense agitation or emotion
IELTS_1229	helicopter	n. 直升飞机	/'helɪkɒptə/	/'hɛlɪkɑptɚ/	n. 直升机 / vt. 由直升机运送 / vi. 乘直升机	'helikɒptә	n. an aircraft without wings that obtains its lift from the rotation of overhead blades
IELTS_3647	herbal	adj. 草本植物的；药草的； n. 草本植物志； 药草书	/'hɜːbəl/	/'ɝbl/	a. 草药的 / [医] 本草书	'hә:bәl	a. of or relating to herbs
IELTS_3517	herbivore	n. 食草动物	/'hɜːbɪvɔː(r)/	/ɝ​bəˌvɔr/	n. 草食动物	'hә:bivɒ:	n. any animal that feeds chiefly on grass and other plants
IELTS_2049	hilarious	adj. 狂欢的，热闹的	/hɪ'leərɪəs/	/hɪ'lɛrɪəs/	a. 喜不自禁的, 欢闹的, 引人发笑的	hi'lєәriәs	s. marked by or causing boisterous merriment or convulsive laughter
IELTS_2054	historic	adj. 有历史意义的	/hɪ'stɒrɪk/	/hɪ'stɔrɪk/	a. 历史上著名的, 有历史性的	hi'stɒrik	s. belonging to the past; of what is important or famous in the past / s. important in history
IELTS_2056	hitchhike	v. 免费搭乘他人便车	/'hɪtʃhaɪk/	/'hɪtʃ,haɪk/	vi. 搭便车 / vt. 要求(搭便车)	'hitʃhaik	v. travel by getting free rides from motorists
IELTS_4660	holistically	adv. 整体地， 全盘地	/həu'lɪstɪkli/	/həu'lɪstɪkli/	adv. holistic（整体的, 全盘的）的副词形式	-kli	
IELTS_2931	holocaust	n. 大破坏	/'hɒləkɔːst/	/'hɑləkɔst/	n. 大屠杀, 大火灾, 毁灭, 大规模烧杀	'hɔlәkɔ:st	n. an act of mass destruction and loss of life (especially in war or by fire) / n. the mass murder of Jews under the German Nazi regime from 1941 until 1945
IELTS_3980	homesick	adj. 想家的， 思乡的	/'həumsɪk/	/'homsɪk/	a. 思家的, 思乡病的	'hәumsik	s. longing to return home
IELTS_2932	homestay	n. 在当地居民家居住	/'həʊmsteɪ/	/'homste/	n. （在国外的访问者）在当地居民家居住的时期	'hәumstei	
IELTS_2933	homogeneous	adj. 同类的，同族的	/,hɒmə(ʊ)'dʒiːnɪəs; -'dʒen-/	/,homə'dʒinɪəs/	a. 同种的, 同质的, 齐性的 / [医] 同种的, 纯一的, 同质的, 均匀的	.hәumә'dʒi:niәs	a. all of the same or similar kind or nature
IELTS_2934	hop	v&n. 单足跳，弹跳	/hɒp/	/hɑp/	n. 单脚跳, 跳跃, 舞会, 飞行 / vi. 单脚跳, 跳跃 / vt. 跃过, 跳上, 加蛇麻子于, 服麻醉药 / [计] 跳跃式传输	hɒp	n. the act of hopping; jumping upward or forward (especially on one foot) / n. twining perennials having cordate leaves and flowers arranged in conelike spikes; the dried flowers of this plant are used in brewing to add the characteristic bitter taste to beer / n. an informal dance where popular music is played / v. jump lightly
IELTS_2943	hound	n. 猎狗；卑鄙的人； v. 用猎狗追，追逐	/haʊnd/	/haʊnd/	n. 猎犬 / vt. 带猎犬狩猎, 追捕, 激励, 使追逐	haund	n. any of several breeds of dog used for hunting typically having large drooping ears / v. pursue or chase relentlessly
IELTS_5077	however	conj. 不管用什么方法，	/hau'evə(r)/	/haʊ'ɛvɚ/	adv. 然而, 无论如何, 究竟怎样 / conj. 然而, 可是	hau'evә	r. despite anything to the contrary (usually following a concession) / r. by contrast; on the other hand; the second, however, took hours" / r. to whatever degree or extent / r. in whatever way or manner
IELTS_2945	howl	n&v. 嚎叫，怒吼	/haʊl/	/haʊl/	n. 嗥叫, 吠声, 号叫 / vi. 狂吠, 咆哮, 呼啸 / vt. 对...吼叫, 狂喊着说	haul	n. a long loud emotional utterance / n. the long plaintive cry of a hound or a wolf / n. a loud sustained noise resembling the cry of a hound / v. emit long loud cries
IELTS_363	hubbub	n. 吵闹，喧哗	/'hʌbʌb/	/'hʌbʌb/	n. 吵闹声, 叫嚷声, 混乱	'hʌbʌb	n. loud confused noise from many sources
IELTS_376	hypothesis	n. (逻辑)前提，假说	/haɪ'pɒθɪsɪs/	/haɪ'pɑθəsɪs/	n. 假设 / [化] 假设	hai'pɒθәsis	n. a proposal intended to explain certain facts or observations / n. a tentative insight into the natural world; a concept that is not yet verified but that if true would explain certain facts or phenomena
IELTS_1242	illustrate	v. 举例或以图表说明，配以插图	/'ɪləstreɪt/	/'ɪləstret/	vt. 举例说明, 作图解, 阐明 / vi. 举例说明	'ilәstreit	v. depict with an illustration / v. supply with illustrations
IELTS_4795	imagination	n. 想象； 想象出来的事物	/ɪˌmædʒɪ'neɪʃn/	/ɪ,mædʒɪ'neʃən/	n. 想像, 听觉, 想像力 / [医] 想像	i.mædʒi'neiʃәn	n. the formation of a mental image of something that is not perceived as real and is not present to the senses / n. the ability to form mental images of things or events
IELTS_1243	imaginative	adj. 想象的，有想象力的	/ɪ'mædʒɪnətɪv/	/ɪ'mædʒɪnətɪv/	a. 想像的, 虚构的	i'mædʒinәtiv	s. (used of persons or artifacts) marked by independence and creativity in thought or action
IELTS_4046	imagine	v. 想象； 猜想	/ɪ'mædʒɪn/	/ɪ'mædʒɪn/	vt. 想像, 设想, 猜测 / vi. 想像起来	i'mædʒin	v. form a mental image of something that is not present or that is not the case
IELTS_1246	immense	adj. 广大的，巨大的	/ɪ'mens/	/ɪ'mɛns/	a. 极广大的, 无边的, 非常好的	i'mens	s unusually great in size or amount or degree or especially extent or scope
IELTS_1249	imminent	adj. 迫近的，紧迫的	/'ɪmɪnənt/	/'ɪmɪnənt/	a. 即将来临的, 逼近的	'iminәnt	s close in time; about to occur
IELTS_1256	imperial	adj. 帝国的，皇帝的	/ɪm'pɪərɪəl/	/ɪm'pɪrɪəl/	a. 帝王的, 宗主国的, 至尊的, 壮丽的 / n. 特等品	im'piәriәl	n. a small tufted beard worn by Emperor Napoleon III / n. a piece of luggage carried on top of a coach / a. relating to or associated with an empire / a. of or belonging to the British Imperial System of weights and measures
IELTS_3807	imperil	v. 使陷于危险， 危及	/ɪm'perəl/	/ɪm'pɛrəl/	vt. 使处于危险, 危害	im'peril	v pose a threat to; present a danger to
IELTS_2063	imposing	adj. 壮观的，气势雄伟的	/ɪm'pəʊzɪŋ/	/ɪm'pozɪŋ/	a. 令人难忘的, 壮丽的, 威风的	im'pәuziŋ	v compel to behave in a certain way / v impose something unpleasant / v impose and collect / s impressive in appearance / s used of a person's appearance or behavior; befitting an eminent person
IELTS_3502	impoverish	v. 使贫困； 使枯竭， 使贫瘠	/ɪm'pɒvərɪʃ/	/ɪm'pɑvərɪʃ/	vt. 使贫穷, 耗尽...的力气	im'pɒvәriʃ	v. make poor
IELTS_2065	impromptu	a&ad. 无准备的(地)；即兴的(地)	/ɪm'prɒm(p)tjuː/	/ɪm'prɑmptu/	n. 即席演出, 即兴曲 / a. 即席的 / adv. 即席	im'prɒmptju:	n. an extemporaneous speech or remark / n. a short musical passage that seems to have been made spontaneously without advance preparation
IELTS_1170	in	prep. favour； of赞成，以. 为收款人	/ɪn/	/ɪn/	prep. 在...期间, 在...之内, 处于...之中, 从事于, 按照, 穿着 / adv. 进入, 朝里, 在里面, 在屋里 / a. 在里面的, 在朝的 / n. 执政者, 交情	in	s. holding office / s. directed or bound inward / s. currently fashionable / r. to or toward the inside of
IELTS_3773	in addition to	除. 之外（还有，也）	/in addition to/	/in addition to/	除...之外		
IELTS_3494	in comparison with	n. 与…比较，同…比较起来	/in comparison with/	/in comparison with/	与...比较		
IELTS_2069	inaugurate	v. 为举行就职典礼，为展览会揭幕，开创	/ɪ'nɔːgjʊreɪt/	/ɪ'nɔɡjəret/	vt. 开始, 举行...就职典礼	i'nɒ:gjureit	v. commence officially / v. open ceremoniously or dedicate formally / v. be a precursor of
IELTS_2073	incipient	adj. 开始的；早期的	/ɪn'sɪpɪənt/	/ɪn'sɪpɪənt/	a. 起初的, 发端的, 初期的 / [医] 初发的, 初期的	in'sipiәnt	s. only partly in existence; imperfectly formed
IELTS_2078	incongruous	adj. 不适宜的	/ɪn'kɒŋgrʊəs/	/ɪn'kɑŋɡruəs/	a. 不协调的, 不一致的, 不合适的	in'kɒŋgruәs	a. lacking in harmony or compatibility or appropriateness
IELTS_2946	indelible	adj. 去不掉的，擦不掉的	/ɪn'delɪb(ə)l/	/ɪn'dɛləbl/	a. 难以消除的, 不能拭除的, 难忘的	in'delibl	s. cannot be removed or erased
IELTS_2949	indicator	n. 指示者，指示物	/'ɪndɪkeɪtə/	/'ɪndɪketɚ/	n. 指示器, 指示剂, 指标 / [计] 指示器	'indikeitә	n. a signal for attracting attention / n. a device for showing the operating condition of some system / n. (chemistry) a substance that changes color to indicate the presence of some ion or substance; can be used to indicate the completion of a chemical reaction or (in medicine) to test for a particular reaction
IELTS_2950	indifferent	adj. 不感兴趣的，不关心的，质量不高的	/ɪn'dɪf(ə)r(ə)nt/	/ɪn'dɪfrənt/	a. 漠不关心的, 无重要性的, 中立的 / [医] 中性的, 无作用的, 无亲和力的, 淡漠的	in'difәrәnt	s. showing no care or concern in attitude or action / s. fairly poor to not very good / s. marked by no especial liking or dislike or preference for one thing over another / s. characterized by a lack of partiality
IELTS_2953	indispensable	adj. 必不可少的，必需的	/ɪndɪ'spensəb(ə)l/	/'ɪndɪ'spɛnsəbl/	n. 不可缺少之物 / a. 不可缺少的, 责无旁贷的, 绝对必要的	.indis'pensәbl	a. not to be dispensed with; essential / s. unavoidable
IELTS_2955	induce	v. 导致；引起	/ɪn'djuːs/	/ɪn'dus/	vt. 引诱, 招致, 归纳出, 感应 / [医] 诱导, 感应	in'dju:s	v. cause to arise / v. cause to do; cause to act in a specified manner / v. cause to occur rapidly / v. reason or establish by induction
IELTS_2956	indulge	v. 放纵，沉迷于	/ɪn'dʌldʒ/	/ɪn'dʌldʒ/	vt. 纵情于, 使高兴, 放任, 迁就 / vi. 沉溺	in'dʌldʒ	v. give free rein to / v. enjoy to excess
IELTS_3628	industrialise	v. 工业化	/ɪn'dʌstrɪəlaɪz/	/ɪn'dʌstrɪəlaɪz/	vi.vt. (使)工业化	in'dʌstriәlaiz	v organize (the production of something) into an industry / v develop industry; become industrial
IELTS_4316	inescapable	adj. 不可逃避的； 难免的	/ˌɪnɪ'skeɪpəbl/	/'ɪnə'skepəbl/	a. 逃不掉的, 不可避免的	.ini'skeipәbl	s impossible to avoid or evade:"inescapable conclusion"
IELTS_2963	infectious	adj. 传染的；感染性的	/ɪn'fekʃəs/	/ɪn'fɛkʃəs/	a. 有传染性的, 易传染的 / [医] 传染性的	in'fekʃәs	s. caused by infection or capable of causing infection / a. easily spread; children catch it from their elders"- Bertrand Russell / a. of or relating to infection
IELTS_2965	inferior	n. 地位(能力)低的人； adj. 劣质的,差的,下等的"	/ɪn'fɪərɪə/	/ɪn'fɪrɪɚ/	a. 次等的, 较差的, 下方的, 下级的 / n. 部下, 次品, 下标(符号)	in'fiәriә	n. one of lesser rank or station or quality / a. of or characteristic of low rank or importance / a. of low or inferior quality / a. having an orbit between the sun and the Earth's orbit
IELTS_2966	infest	v. 大批出动，成群出现(鼠类及害虫)	/ɪn'fest/	/ɪn'fɛst/	vt. 骚扰, 寄生于, 大批出没 / [医] 传染, 感染	in'fest	v. invade in great numbers / v. live on or in a host, as of parasites
IELTS_387	inflict	v. 使遭受，强加	/ɪn'flɪkt/	/ɪn'flɪkt/	vt. 施以, 加害, 使承受 / [法] 处, 加, 予以	in'flikt	v. impose something unpleasant
IELTS_3669	influential	adj. 有影响力的； 有权势的	/ˌɪnflu'enʃl/	/,ɪnflu'ɛnʃl/	a. 有影响的, 有势力的	.infu'enʃәl	a. having or exercising influence or power
IELTS_5261	informant	n. 提供消息或情报的人， 线人； 提供资料的人	/ɪn'fɔːmənt/	/ɪn'fɔrmənt/	n. 提供消息者, 密告者, 被调查者 / [经] 填报人, 被征询人	in'fɒ:mәnt	n. a person who supplies information
IELTS_392	ingredient	n. (混合物的)组成部分，配料	/ɪn'griːdɪənt/	/ɪn'ɡridɪənt/	n. 成分, 因素 / [化] 配合剂; 拼料; 成分; 组分	in'gri:diәnt	n. a component of a mixture or compound / n. food that is a component of a mixture in cooking
IELTS_399	initiate	v. 创始，着手，介绍某人为(会员等)	/ɪ'nɪʃɪeɪt/	/ɪ'nɪʃɪet/	n. 入会, 开始 / a. 新加入的 / vt. 开始, 传授基本知识给	i'niʃieit	n. someone who has been admitted to membership in a scholarly field / n. people who have been introduced to the mysteries of some field or activity / v. take the lead or initiative in; participate in the development of / v. accept people into an exclusive society or group, usually with some rite
IELTS_400	initiative	n. 发端，创始，主动性	/ɪ'nɪʃɪətɪv; -ʃə-/	/ɪ'nɪʃətɪv/	n. 主动行动, 首创精神, 主动权 / a. 自发的, 起始的	i'niʃiәtiv	n readiness to embark on bold new ventures / n the first of a series of actions / s serving to set in motion
IELTS_407	insane	adj. 愚蠢的; 疯狂的	/ɪn'seɪn/	/ɪn'sen/	a. 患精神病的, 极愚蠢的 / [医] 神经错乱的	in'sein	a. afflicted with or characteristic of mental derangement
IELTS_4131	inscribe	v. 写、 题、 铭刻； 牢记， 铭记	/ɪn'skraɪb/	/ɪn'skraɪb/	vt. 登记, 铭记于, 题写, 雕刻 / [电] 书写	in'skraib	v. draw within a figure so as to touch in as many places as possible / v. write, engrave, or print as a lasting record / v. address, (a work of literature) in a style less formal than a dedication
IELTS_1261	insolent	adj. 蛮横的，粗鲁的	/'ɪns(ə)l(ə)nt/	/'ɪnsələnt/	n. 侮慢无礼的人 / a. 粗野的, 无礼的, 侮慢的	'insәlәnt	s marked by casual disrespect / s unrestrained by convention or propriety
IELTS_1262	insolvent	adj. 无偿债能力的	/ɪn'sɒlv(ə)nt/	/ɪn'sɑlvənt/	a. 无力偿还的, 破产的 / n. 无力偿还者, 破产者	in'sɒlvәnt	a. unable to meet or discharge financial obligations
IELTS_1265	inspire	v. 激励，鼓励，灌注以创造力	/ɪn'spaɪə/	/ɪn'spaɪɚ/	vt. 使感动, 激发, 启示, 吸入, 鼓舞, 产生, 使生灵感 / vi. 吸入, 赋予灵感	in'spaiә	v. heighten or intensify / v. supply the inspiration for
IELTS_1266	inspiring	adj. 令人振奋的	/ɪn'spaɪərɪŋ/	/ɪn'spaɪərɪŋ/	a. 鼓舞人心的	in'spaiәriŋ	a. stimulating or exalting to the spirit
IELTS_1268	instalment	n. 分期连载，分期支付的款子	/ɪn'stɔːlm(ə)nt/	/ɪn'stɔlm(ə)nt/	n. 就职, 装设, 分期付款	in'stɒ:lmәnt	n a part of a broadcast serial / n a part of a published serial / n the act of installing something (as equipment)
IELTS_1269	instantaneous	adv. 瞬间，霎时	/,ɪnst(ə)n'teɪnɪəs/	/,ɪnstən'tenɪəs/	a. 即时的, 瞬间的, 猝发的 / [机] 瞬时的	.instәn'teinjәs	s. occurring with no delay
IELTS_1272	instrumental	adj. 起作用的，有助于，乐器的	/ɪnstrʊ'ment(ə)l/	/,ɪnstrə'mɛntl/	a. 仪器的, 器具的, 可作为手段的 / [医] 器械的	.instru'mentәl	a. relating to or designed for or performed on musical instruments
IELTS_4746	insularity	n. 岛国； 与外界隔绝的生活状况； 褊狭	/ˌɪnsju'lærəti/	/ˌɪnsju'lærəti/	n. 岛屿生活状况, 孤立, 岛国性质	.insju'læriti	n the state of being isolated or detached
IELTS_1279	integrate	v. 使一体化，取消种族隔离	/'ɪntɪgreɪt/	/'ɪntɪɡret/	vt. 综合, 使完整, 使成整体 / vi. 成一体 / a. 完整的, 完全的	'intigreit	v. make into a whole or make part of a whole / v. become one; become integrated / v. calculate the integral of; calculate by integration
IELTS_2089	interact	v. 干预，干涉，触犯，妨碍	/ɪntər'ækt/	/,ɪntɚ'ækt/	vi. 互相影响, 交互作用 / n. 幕间剧, 幕间休息	.intәr'ækt	v. act together or towards others or with others
IELTS_5055	interdependent	adj. 互相依赖的， 互助的	/ˌɪntədɪ'pendənt/	/,ɪntɚdɪ'pɛndənt/	a. 相互依赖的, 相互依存的	.intәdi'pendәnt	s. mutually dependent
IELTS_3768	intermix	v. 混入， 混杂	/ˌɪntə'mɪks/	/,ɪntɚ'mɪks/	v. (使)混和, (使)混杂	.intә'miks	v combine into one
IELTS_4921	internship	n. 实习生身份； 实习医师	/'ɪntɜːnʃɪp/	/'ɪntɝnʃɪp/	n. 实习医师的职务 / [医] 实习医师职位, 实习医师期	'intә:nʃip	n. the position of a medical intern
IELTS_5273	interplay	vi&n. 相互作用， 相互影响	/'ɪntəpleɪ/	/,ɪntɚ'plɛi/	n. 互相作用, 互相影响 / vi. 互相作用	'intәplei	n. reciprocal action and reaction
IELTS_4118	interrelationship	n. 相互关联， 相互影响	/ˌɪntərɪ'leɪʃnʃɪp/	/,ɪntərɪ'leʃnʃɪp/	n. 相互关系		n mutual or reciprocal relation or relatedness
IELTS_2096	intersection	n. 交**点，十字街口	/ɪntə'sekʃ(ə)n/	/,ɪntɚ'sɛkʃən/	n. 交集, 十字路口, 交叉点 / [计] 逻辑乘; 与	.intә'sekʃәn	n. a point where lines intersect / n. a junction where one street or road crosses another / n. a point or set of points common to two or more geometric configurations
IELTS_3851	invader	n. 入侵者	/ɪn'veɪdə(r)/	/ɪn'vedɚ/	n. 侵略者 / [化] 侵入物	in'veidә	n. someone who enters by force in order to conquer
IELTS_2971	invariably	adv. 不变地，永恒地	/ɪn'veərɪəblɪ/	/ɪn'vɛrɪəbli/	adv. 不变化地, 恒定地, 始终如一地	in'vєәriәbli	r without variation or change, in every case
IELTS_4867	invasion	n. 入侵， 侵略	/ɪn'veɪʒn/	/ɪn'veʒn/	n. 侵犯, 侵入, 侵害 / [医] 侵袭, 侵入, 发病	in'veiʒәn	n. the act of invading; the act of an army that invades for conquest or plunder / n. any entry into an area not previously occupied / n. (pathology) the spread of pathogenic microorganisms or malignant cells to new sites in the body
IELTS_4999	invasive	adj. 侵略的， 入侵的； 侵袭的， 扩散的； 切入的， 开刀的	/ɪn'veɪsɪv/	/ɪn'vesɪv/	a. 侵入的, 侵略性的, 攻击性的	in'veisiv	a. relating to a technique in which the body is entered by puncture or incision / a. marked by a tendency to spread especially into healthy tissue
IELTS_5123	irrevocable	adj. 无法取消的， 不能改变的	/ɪ'revəkəbl/	/ɪ'rɛvəkəbl/	a. 不能挽回的, 不能取消的, 不能变更的 / [经] 不能撤销的, 不能恢复的	i'revәkәbl	a. incapable of being retracted or revoked
IELTS_2986	isolate	v. 隔离，孤立	/'aɪsəleɪt/	/aɪslˌet/	vt. 使隔离, 使孤立, 使绝缘 / n. 隔离种群	'aisәleit	v. place or set apart / v. obtain in pure form / v. separate (experiences) from the emotions relating to them
